{
  "assembly_sha256": "5b2b203a5a3c9c475f0c09c94a3cf754d22105ae2650faa9db54ded170b2dab2",
  "contig_count": 39045,
  "filter_mode": "strict",
  "gc_fraction_acgt": 0.47050158428068434,
  "maximum_contig_bp": 75817,
  "minimum_contig_bp": 500,
  "n50_bp": 2543,
  "n90_bp": 662,
  "n_fraction": 0.0,
  "other_ambiguous_fraction": 0.0,
  "privacy": {
    "contains_contig_identifiers": false,
    "contains_filesystem_paths": false,
    "contains_sequences": false
  },
  "sample_id": "SRR13348789",
  "schema_version": "1.0",
  "total_bp": 65549622
}
