{
  "assembly_sha256": "7bbfa1857b89b204575c3812db0a77db9111b31161c4ee2336ed71002d6f47c7",
  "contig_count": 38254,
  "filter_mode": "source",
  "gc_fraction_acgt": 0.4437453068609976,
  "maximum_contig_bp": 375027,
  "minimum_contig_bp": 500,
  "n50_bp": 3535,
  "n90_bp": 701,
  "n_fraction": 0.0,
  "other_ambiguous_fraction": 0.0,
  "privacy": {
    "contains_contig_identifiers": false,
    "contains_filesystem_paths": false,
    "contains_sequences": false
  },
  "sample_id": "SRR5127623",
  "schema_version": "1.0",
  "total_bp": 74847293
}
